{"root":"catalog/ewma","entry":"ewma","defsInProgram":3,"modules":[{"name":"catalog/ewma","path":"catalog/ewma.viv","lines":110,"src":"# Gap-aware EWMA: an exponentially weighted mean that decays with elapsed time.\n#\n# Input: one row per event, sorted by (user, ts); ts in int64 nanoseconds.\n# Each user carries a weighted sum S and a weight W. Before the rows at an\n# instant t are scored, both decay by\n#\n#     f = exp(-ln 2 * (t - t_prev) / half_life)\n#\n# where t_prev is the user's previous instant, so a value loses half its\n# weight every half_life of real time, however many events fall in between.\n# The rows at t are scored on that state:\n#\n#   ewma        S / W, NaN when the user has no value since the start or the\n#               last reset\n#   ewm_weight  W: the decayed count of values behind the mean\n#\n# Then the instant's rows update it: if any of them has reset = 1 the state is\n# cleared first, and then every value at t is added with weight 1. A row never\n# sees its own value or its own reset.\n\nfrom rows import group_end, instant_end\n\nLN2: Num = 0.6931471805599453\n\nrecord Ewma {\n    ewma: Arr\n    ewm_weight: Arr\n}\n\n#| A time-decayed mean of each user's earlier values, with resets, for events\n#| sorted by (user, ts).\n#|| The state decays from the previous instant to this one, the instant's rows\n#|| read it, and then the instant's values (after any reset) join it.\n#||| Decaying by elapsed time instead of by row count makes a burst of events\n#||| and a quiet month weigh what they span, not how many rows they hold.\n#: user  the entity key, sorted ascending\n#: ts  event time, int64 nanoseconds, ascending within a user\n#: value  the measurement each event carries\n#: reset  1 on an event that starts the user's mean over, else 0\n#: half_life  the time, in nanoseconds, over which a value loses half its weight\n#@ a112ac3b\ndef ewma(user: [Int], ts: [Int], value: Arr, reset: [Int], half_life: Int) -> Ewma {\n    n = len(ts)\n    mean = zeros(n)\n    weight = zeros(n)\n    g: Int = 0\n    while g < n {\n        stop_at = group_end(user, ts, g, \"ewma\")\n        s = 0.0\n        w = 0.0\n        t_prev: Int = ts[g]\n        i: Int = g\n        while i < stop_at {\n            t = ts[i]\n            same = instant_end(ts, i, stop_at)\n            step decay \"the state decays from the previous instant to this one\" {\n                f = exp(-LN2 * float(t - t_prev) / float(half_life))\n                s = s * f\n                w = w * f\n                t_prev = t\n            }\n            step read \"the instant's rows read the state before their own values\" {\n                m = 0.0 / 0.0\n                if w > 0.0 {\n                    m = s / w\n                }\n                for k from i to same {\n                    mean[k] = m\n                    weight[k] = w\n                }\n            }\n            step update \"a reset clears the state, then the instant's values join it\" {\n                cleared = false\n                for k from i to same {\n                    if reset[k] != 0 {\n                        cleared = true\n                    }\n                }\n                if cleared {\n                    s = 0.0\n                    w = 0.0\n                }\n                for k from i to same {\n                    s += value[k]\n                    w += 1.0\n                }\n            }\n            i = same\n        }\n        g = stop_at\n    }\n    return Ewma { ewma: mean, ewm_weight: weight }\n}\n\ntest \"one half-life halves the weight; a reset starts over\" {\n    user: [Int] = [1, 1, 1, 1]\n    ts: [Int] = [0, 10, 10, 20]\n    value = [4.0, 8.0, 100.0, 0.0]\n    reset: [Int] = [0, 0, 1, 0]\n    e = ewma(user, ts, value, reset, 10)\n    assert_true(e.ewma[0] != e.ewma[0])\n    assert_near(e.ewma[1], 4.0, 0.0)\n    assert_near(e.ewm_weight[1], 0.5, 1.0e-15)\n    assert_near(e.ewma[2], 4.0, 0.0)\n    assert_near(e.ewma[3], 54.0, 1.0e-12)\n    assert_near(e.ewm_weight[3], 1.0, 1.0e-15)\n}\n\n# SPDX-License-Identifier: MIT OR Apache-2.0\n# SPDX-FileCopyrightText: 2026 The Viv authors\n"},{"name":"./rows","path":"catalog/rows.viv","lines":46,"src":"# Row groups shared by the catalog's features: rows sorted by (key, ts).\n\n#| The end (exclusive) of the key group that starts at row `start`, after\n#| checking that the rows are sorted by (key, ts); `who` names the caller in\n#| the error.\n#: key  the entity key of each row\n#: ts  each row's time, int64 nanoseconds\n#: start  the first row of the group\n#@ 2c0afca7\ndef group_end(key: [Int], ts: [Int], start: Int, who: Str) -> Int {\n    n = len(ts)\n    stop_at: Int = start + 1\n    while stop_at < n and key[stop_at] == key[start] {\n        if ts[stop_at] < ts[stop_at - 1] {\n            stop(f\"{who}: rows must be sorted by (key, ts); row {stop_at} goes back in time\")\n        }\n        stop_at += 1\n    }\n    if stop_at < n and key[stop_at] < key[start] {\n        stop(f\"{who}: rows must be sorted by (key, ts); the key falls at row {stop_at}\")\n    }\n    return stop_at\n}\n\n#| The end (exclusive) of the run of rows at row `i`'s instant, within a group\n#| ending at `stop_at`.\n#: i  the first row of the instant\n#: stop_at  the end of the key group\n#@ 9ee224e9\ndef instant_end(ts: [Int], i: Int, stop_at: Int) -> Int {\n    j: Int = i\n    while j < stop_at and ts[j] == ts[i] {\n        j += 1\n    }\n    return j\n}\n\ntest \"groups and instants\" {\n    key: [Int] = [1, 1, 1, 2]\n    ts: [Int] = [5, 5, 7, 0]\n    assert_true(group_end(key, ts, 0, \"t\") == 3 and group_end(key, ts, 3, \"t\") == 4)\n    assert_true(instant_end(ts, 0, 3) == 2 and instant_end(ts, 2, 3) == 3)\n}\n\n# SPDX-License-Identifier: MIT OR Apache-2.0\n# SPDX-FileCopyrightText: 2026 The Viv authors\n"}],"defs":[{"id":"ewma","module":0,"line":42,"end":93,"params":["user","ts","value","reset","half_life"],"doc":"A time-decayed mean of each user's earlier values, with resets, for events\nsorted by (user, ts).\nThe state decays from the previous instant to this one, the instant's rows\nread it, and then the instant's values (after any reset) join it.\nDecaying by elapsed time instead of by row count makes a burst of events\nand a quiet month weigh what they span, not how many rows they hold.\nuser  the entity key, sorted ascending\nts  event time, int64 nanoseconds, ascending within a user\nvalue  the measurement each event carries\nreset  1 on an event that starts the user's mean over, else 0\nhalf_life  the time, in nanoseconds, over which a value loses half its weight\n@ a112ac3b","intent":"A time-decayed mean of each user's earlier values, with resets, for events sorted by (user, ts).","dist":0,"from":null,"steps":[{"id":"decay","text":"the state decays from the previous instant to this one","line":56,"end":61},{"id":"read","text":"the instant's rows read the state before their own values","line":62,"end":71},{"id":"update","text":"a reset clears the state, then the instant's values join it","line":72,"end":87}],"loops":[{"line":47,"end":91,"depth":1,"head":"while g < n"},{"line":53,"end":89,"depth":2,"head":"while i < stop_at"},{"line":67,"end":70,"depth":3,"head":"for k from i to same"},{"line":74,"end":78,"depth":3,"head":"for k from i to same"},{"line":83,"end":86,"depth":3,"head":"for k from i to same"}],"calls":[["group_end",48,1,0],["instant_end",55,2,0]],"indirect":[],"builtins":{"exp":1,"float":2,"len":1,"zeros":2}},{"id":"group_end","module":1,"line":10,"end":23,"params":["key","ts","start","who"],"doc":"The end (exclusive) of the key group that starts at row `start`, after\nchecking that the rows are sorted by (key, ts); `who` names the caller in\nthe error.\nkey  the entity key of each row\nts  each row's time, int64 nanoseconds\nstart  the first row of the group\n@ 2c0afca7","intent":"The end (exclusive) of the key group that starts at row `start`, after checking that the rows are sorted by (key, ts); `who` names the caller in the error.","dist":1,"from":"ewma","steps":[],"loops":[{"line":13,"end":18,"depth":1,"head":"while stop_at < n and key[stop_at] == key[start]"}],"calls":[],"indirect":[],"builtins":{"len":1,"stop":2}},{"id":"instant_end","module":1,"line":30,"end":36,"params":["ts","i","stop_at"],"doc":"The end (exclusive) of the run of rows at row `i`'s instant, within a group\nending at `stop_at`.\ni  the first row of the instant\nstop_at  the end of the key group\n@ 9ee224e9","intent":"The end (exclusive) of the run of rows at row `i`'s instant, within a group ending at `stop_at`.","dist":1,"from":"ewma","steps":[],"loops":[{"line":32,"end":34,"depth":1,"head":"while j < stop_at and ts[j] == ts[i]"}],"calls":[],"indirect":[],"builtins":{}}],"contracts":[]}
