{"root":"kernels/k1/norms","entry":"enorm","defsInProgram":3,"modules":[{"name":"kernels/k1/norms","path":"kernels/k1/norms.viv","lines":34,"src":"# Kernel collection K1: MINPACK's overflow-safe Euclidean norm.\n#\n# The adapter over lib/minpack/enorm.viv, a port of netlib's enorm.f, takes\n# the array alone, as numpy.linalg.norm does; the library def also takes\n# the count.\n\nimport minpack.enorm\n\n#| The Euclidean norm of x, with no overflow or underflow in the sum of\n#| squares (MINPACK enorm). An empty x has norm 0.\ndef enorm(x: Arr) -> Num {\n    if len(shape(x)) != 1 {\n        stop(\"enorm: x must be one-dimensional\")\n    }\n    if len(x) == 0 {\n        return 0.0\n    }\n    return minpack.enorm.enorm(len(x), x)\n}\n\ntest \"3-4-12-84 gives 85, at ordinary and at extreme scales\" {\n    v = [3.0, 4.0, 12.0, 84.0]\n    assert_near(enorm(v), 85.0, 0.0)\n    assert_near(enorm(1.0e300 * v) / 8.5e301, 1.0, 1.0e-15)\n    assert_near(enorm(1.0e-300 * v) / 8.5e-299, 1.0, 1.0e-15)\n}\n\ntest \"the empty vector has norm 0\" {\n    assert_near(enorm(zeros(0)), 0.0, 0.0)\n}\n\n# SPDX-License-Identifier: LicenseRef-Minpack\n# SPDX-FileCopyrightText: 1999 University of Chicago (Argonne National Laboratory, MINPACK)\n# SPDX-FileCopyrightText: 2026 The Viv authors\n"},{"name":"lib/minpack/enorm","path":"lib/minpack/enorm.viv","lines":99,"src":"###\npost: enorm and dpmpar from MINPACK\nagent: claude\n\nA port of `enorm.f` and of the IEEE branch of `dpmpar.f` from netlib MINPACK\n(lib/minpack/ref). The explanation is in lib/minpack/enorm.intent.\n\nUsed with `import minpack.enorm`.\n###\n\n# dpmpar(1) and dpmpar(2) exactly as netlib's dpmpar.f writes them for IEEE\n# machines: 11 significant digits, not the exact powers of two\nEPSMCH = 2.22044604926e-16\nDWARF = 2.22507385852e-308\n# enorm's two thresholds, from its data statement\nRDWARF = 3.834e-20\nRGIANT = 1.304e19\n\ndef enorm(n, x: Arr) {\n    s1 = 0.0\n    s2 = 0.0\n    s3 = 0.0\n    x1max = 0.0\n    x3max = 0.0\n    agiant = RGIANT / n\n    for i to n {\n        xabs = abs(x[i])\n        if xabs > RDWARF and xabs < agiant {\n            s2 = s2 + xabs * xabs\n        } else if xabs <= RDWARF {\n            if xabs > x3max {\n                q = x3max / xabs\n                s3 = 1.0 + s3 * (q * q)\n                x3max = xabs\n            } else if xabs != 0.0 {\n                q = xabs / x3max\n                s3 = s3 + q * q\n            }\n        } else if xabs > x1max {\n            q = x1max / xabs\n            s1 = 1.0 + s1 * (q * q)\n            x1max = xabs\n        } else {\n            q = xabs / x1max\n            s1 = s1 + q * q\n        }\n    }\n    if s1 != 0.0 {\n        return x1max * sqrt(s1 + (s2 / x1max) / x1max)\n    }\n    if s2 != 0.0 {\n        if s2 >= x3max {\n            return sqrt(s2 * (1.0 + (x3max / s2) * (x3max * s3)))\n        }\n        return sqrt(x3max * ((s2 / x3max) + (x3max * s3)))\n    }\n    return x3max * sqrt(s3)\n}\n\n#~ test\ndef en_naive(x: Arr) {\n    s = 0.0\n    for i to len(x) {\n        s = s + x[i] * x[i]\n    }\n    return sqrt(s)\n}\n\ntest \"for ordinary numbers enorm is the plain square root of the sum of squares\" {\n    v = [3.0, -4.0, 12.0]\n    assert_near(enorm(len(v), v), 13.0, 0.0)\n    w = [0.1, 0.2, 0.3, 0.4, 0.5]\n    assert_near(enorm(len(w), w), en_naive(w), 1.0e-16)\n}\n\ntest \"enorm reads only the first n entries\" {\n    v = [3.0, 4.0, 100.0]\n    assert_near(enorm(2.0, v), 5.0, 0.0)\n}\n\ntest \"enorm of 1e200 and 1e-200 entries does not overflow or underflow\" {\n    big = [3.0e200, 4.0e200]\n    assert_near(enorm(len(big), big) / 5.0e200, 1.0, 1.0e-15)\n    assert_gt(en_naive(big), 1.0e308)\n    small = [3.0e-200, 4.0e-200]\n    assert_near(enorm(len(small), small) / 5.0e-200, 1.0, 1.0e-15)\n    assert_near(en_naive(small), 0.0, 0.0)\n    mixed = [1.0e200, 1.0, 1.0e-200]\n    assert_near(enorm(len(mixed), mixed) / 1.0e200, 1.0, 0.0)\n}\n\ntest \"enorm of a zero vector is zero\" {\n    z = [0.0, 0.0, 0.0]\n    assert_near(enorm(len(z), z), 0.0, 0.0)\n}\n\n# SPDX-License-Identifier: LicenseRef-Minpack\n# SPDX-FileCopyrightText: 1999 University of Chicago (Argonne National Laboratory, MINPACK)\n# SPDX-FileCopyrightText: 2026 The Viv authors\n"}],"defs":[{"id":"enorm","module":0,"line":11,"end":19,"params":["x"],"doc":"The Euclidean norm of x, with no overflow or underflow in the sum of\nsquares (MINPACK enorm). An empty x has norm 0.","intent":"The Euclidean norm of x, with no overflow or underflow in the sum of squares (MINPACK enorm). An empty x has norm 0.","dist":0,"from":null,"steps":[],"loops":[],"calls":[["lib_minpack_enorm__enorm",18,0,0]],"indirect":[],"builtins":{"len":3,"shape":1}},{"id":"lib_minpack_enorm__enorm","module":1,"line":19,"end":58,"params":["n","x"],"doc":"","intent":"","dist":1,"from":"enorm","steps":[],"loops":[{"line":26,"end":47,"depth":1,"head":"for i to n"}],"calls":[],"indirect":[],"builtins":{"abs":1,"sqrt":4}}],"contracts":[]}
