{"root":"catalog/since_last","entry":"since_last","defsInProgram":3,"modules":[{"name":"catalog/since_last","path":"catalog/since_last.viv","lines":87,"src":"# Time since the last event of a given type, per user.\n#\n# Input: one row per event, sorted by (user, ts); ts in int64 nanoseconds;\n# hit = 1 on the events of the type asked about.\n#\n#   secs_since_hit   seconds since the user's latest event of the type with\n#                    ts < t; NaN when there is none (\"never\")\n#   secs_since_prev  seconds since the user's latest event of any type with\n#                    ts < t; NaN for the user's first instant\n#\n# Rows at the row's own instant, the row included, do not count.\n\nfrom rows import group_end, instant_end\n\nNS_PER_S: Int = 1000000000\n\nrecord SinceLast {\n    secs_since_hit: Arr\n    secs_since_prev: Arr\n}\n\n#| Seconds since the user's previous event of the type and of any type, for\n#| events sorted by (user, ts), NaN where there was none.\n#|| One pass per user, one instant at a time; the instant's rows are read before\n#|| they become the latest events.\n#||| NaN for \"never\" keeps a missing history apart from a gap of zero seconds.\n#: user  the entity key, sorted ascending\n#: ts  event time, int64 nanoseconds, ascending within a user\n#: hit  1 on events of the type asked about, else 0\n#@ caf3bd02\ndef since_last(user: [Int], ts: [Int], hit: [Int]) -> SinceLast {\n    n = len(ts)\n    since_hit = zeros(n)\n    since_prev = zeros(n)\n    never = 0.0 / 0.0\n    g: Int = 0\n    while g < n {\n        stop_at = group_end(user, ts, g, \"since_last\")\n        have_hit = false\n        last_hit: Int = 0\n        i: Int = g\n        while i < stop_at {\n            t = ts[i]\n            same = instant_end(ts, i, stop_at)\n            step read \"the instant's rows see the events before it\" {\n                a = never\n                if have_hit {\n                    a = float(t - last_hit) / float(NS_PER_S)\n                }\n                b = never\n                if i > g {\n                    b = float(t - ts[i - 1]) / float(NS_PER_S)\n                }\n                for k from i to same {\n                    since_hit[k] = a\n                    since_prev[k] = b\n                }\n            }\n            step update \"an event of the type at this instant becomes the latest\" {\n                for k from i to same {\n                    if hit[k] != 0 {\n                        have_hit = true\n                        last_hit = t\n                    }\n                }\n            }\n            i = same\n        }\n        g = stop_at\n    }\n    return SinceLast { secs_since_hit: since_hit, secs_since_prev: since_prev }\n}\n\ntest \"never is NaN and the current instant does not count\" {\n    user: [Int] = [1, 1, 1, 1]\n    ts: [Int] = [0, 2 * NS_PER_S, 2 * NS_PER_S, 5 * NS_PER_S]\n    hit: [Int] = [0, 1, 0, 0]\n    s = since_last(user, ts, hit)\n    assert_true(s.secs_since_hit[0] != s.secs_since_hit[0] and s.secs_since_hit[2] != s.secs_since_hit[2])\n    assert_near(s.secs_since_hit[3], 3.0, 0.0)\n    assert_true(s.secs_since_prev[0] != s.secs_since_prev[0])\n    assert_near(s.secs_since_prev[2], 2.0, 0.0)\n    assert_near(s.secs_since_prev[3], 3.0, 0.0)\n}\n\n# SPDX-License-Identifier: MIT OR Apache-2.0\n# SPDX-FileCopyrightText: 2026 The Viv authors\n"},{"name":"./rows","path":"catalog/rows.viv","lines":46,"src":"# Row groups shared by the catalog's features: rows sorted by (key, ts).\n\n#| The end (exclusive) of the key group that starts at row `start`, after\n#| checking that the rows are sorted by (key, ts); `who` names the caller in\n#| the error.\n#: key  the entity key of each row\n#: ts  each row's time, int64 nanoseconds\n#: start  the first row of the group\n#@ 2c0afca7\ndef group_end(key: [Int], ts: [Int], start: Int, who: Str) -> Int {\n    n = len(ts)\n    stop_at: Int = start + 1\n    while stop_at < n and key[stop_at] == key[start] {\n        if ts[stop_at] < ts[stop_at - 1] {\n            stop(f\"{who}: rows must be sorted by (key, ts); row {stop_at} goes back in time\")\n        }\n        stop_at += 1\n    }\n    if stop_at < n and key[stop_at] < key[start] {\n        stop(f\"{who}: rows must be sorted by (key, ts); the key falls at row {stop_at}\")\n    }\n    return stop_at\n}\n\n#| The end (exclusive) of the run of rows at row `i`'s instant, within a group\n#| ending at `stop_at`.\n#: i  the first row of the instant\n#: stop_at  the end of the key group\n#@ 9ee224e9\ndef instant_end(ts: [Int], i: Int, stop_at: Int) -> Int {\n    j: Int = i\n    while j < stop_at and ts[j] == ts[i] {\n        j += 1\n    }\n    return j\n}\n\ntest \"groups and instants\" {\n    key: [Int] = [1, 1, 1, 2]\n    ts: [Int] = [5, 5, 7, 0]\n    assert_true(group_end(key, ts, 0, \"t\") == 3 and group_end(key, ts, 3, \"t\") == 4)\n    assert_true(instant_end(ts, 0, 3) == 2 and instant_end(ts, 2, 3) == 3)\n}\n\n# SPDX-License-Identifier: MIT OR Apache-2.0\n# SPDX-FileCopyrightText: 2026 The Viv authors\n"}],"defs":[{"id":"since_last","module":0,"line":31,"end":72,"params":["user","ts","hit"],"doc":"Seconds since the user's previous event of the type and of any type, for\nevents sorted by (user, ts), NaN where there was none.\nOne pass per user, one instant at a time; the instant's rows are read before\nthey become the latest events.\nNaN for \"never\" keeps a missing history apart from a gap of zero seconds.\nuser  the entity key, sorted ascending\nts  event time, int64 nanoseconds, ascending within a user\nhit  1 on events of the type asked about, else 0\n@ caf3bd02","intent":"Seconds since the user's previous event of the type and of any type, for events sorted by (user, ts), NaN where there was none.","dist":0,"from":null,"steps":[{"id":"read","text":"the instant's rows see the events before it","line":45,"end":58},{"id":"update","text":"an event of the type at this instant becomes the latest","line":59,"end":66}],"loops":[{"line":37,"end":70,"depth":1,"head":"while g < n"},{"line":42,"end":68,"depth":2,"head":"while i < stop_at"},{"line":54,"end":57,"depth":3,"head":"for k from i to same"},{"line":60,"end":65,"depth":3,"head":"for k from i to same"}],"calls":[["group_end",38,1,0],["instant_end",44,2,0]],"indirect":[],"builtins":{"float":4,"len":1,"zeros":2}},{"id":"group_end","module":1,"line":10,"end":23,"params":["key","ts","start","who"],"doc":"The end (exclusive) of the key group that starts at row `start`, after\nchecking that the rows are sorted by (key, ts); `who` names the caller in\nthe error.\nkey  the entity key of each row\nts  each row's time, int64 nanoseconds\nstart  the first row of the group\n@ 2c0afca7","intent":"The end (exclusive) of the key group that starts at row `start`, after checking that the rows are sorted by (key, ts); `who` names the caller in the error.","dist":1,"from":"since_last","steps":[],"loops":[{"line":13,"end":18,"depth":1,"head":"while stop_at < n and key[stop_at] == key[start]"}],"calls":[],"indirect":[],"builtins":{"len":1,"stop":2}},{"id":"instant_end","module":1,"line":30,"end":36,"params":["ts","i","stop_at"],"doc":"The end (exclusive) of the run of rows at row `i`'s instant, within a group\nending at `stop_at`.\ni  the first row of the instant\nstop_at  the end of the key group\n@ 9ee224e9","intent":"The end (exclusive) of the run of rows at row `i`'s instant, within a group ending at `stop_at`.","dist":1,"from":"since_last","steps":[],"loops":[{"line":32,"end":34,"depth":1,"head":"while j < stop_at and ts[j] == ts[i]"}],"calls":[],"indirect":[],"builtins":{}}],"contracts":[]}
