{"root":"catalog/sessions","entry":"sessions","defsInProgram":3,"modules":[{"name":"catalog/sessions","path":"catalog/sessions.viv","lines":87,"src":"# Sessions: gap-based sessionization per user.\n#\n# Input: one row per event, sorted by (user, ts); ts in int64 nanoseconds.\n# A session is a run of a user's events in which no two consecutive events\n# are more than `gap` apart. A gap of exactly `gap` keeps the session going;\n# a longer one starts a new session. Rows at the same instant share a session.\n#\n#   session_start      ts of the session's first event (with user, the session's id)\n#   session_index      how many sessions of the user started before this one\n#   secs_since_start   (ts - session_start) in seconds\n#   n_prev_in_session  events of the session with an earlier ts (same instant excluded)\n#\n# Every output at a row reads only rows of the same user with ts <= the row's ts.\n\nfrom rows import group_end, instant_end\n\nNS_PER_S: Int = 1000000000\n\nrecord Sessions {\n    session_start: [Int]\n    session_index: [Int]\n    secs_since_start: Arr\n    n_prev_in_session: [Int]\n}\n\n#| Gap-based sessions for events sorted by (user, ts): each row's session start,\n#| the session's index within the user, the seconds since the session started and\n#| the number of earlier events in the session.\n#|| One pass per user, one instant at a time: a gap longer than `gap` before an\n#|| instant closes the session.\n#||| A session id built from a global running counter would change when an\n#||| earlier user gains sessions in the future; the start time does not.\n#: user  the entity key, sorted ascending\n#: ts  event time, int64 nanoseconds, ascending within a user\n#: gap  the longest gap, in nanoseconds, that keeps a session open\n#@ 27f60b7d\ndef sessions(user: [Int], ts: [Int], gap: Int) -> Sessions {\n    n = len(ts)\n    start = int_zeros(n)\n    index = int_zeros(n)\n    secs = zeros(n)\n    nprev = int_zeros(n)\n    g: Int = 0\n    while g < n {\n        stop_at = group_end(user, ts, g, \"sessions\")\n        s_start: Int = ts[g]\n        s_index: Int = 0\n        s_count: Int = 0\n        i: Int = g\n        while i < stop_at {\n            same = instant_end(ts, i, stop_at)\n            step split \"a gap longer than the limit opens a new session\" {\n                if i > g and ts[i] - ts[i - 1] > gap {\n                    s_start = ts[i]\n                    s_index += 1\n                    s_count = 0\n                }\n            }\n            step fill \"the rows of the instant share the session and its past\" {\n                for k from i to same {\n                    start[k] = s_start\n                    index[k] = s_index\n                    nprev[k] = s_count\n                    secs[k] = float(ts[k] - s_start) / float(NS_PER_S)\n                }\n                s_count += same - i\n            }\n            i = same\n        }\n        g = stop_at\n    }\n    return Sessions { session_start: start, session_index: index, secs_since_start: secs, n_prev_in_session: nprev }\n}\n\ntest \"a gap of exactly the limit keeps the session; a longer one splits it\" {\n    user: [Int] = [1, 1, 1, 1, 2]\n    ts: [Int] = [0, 10, 10, 30, 0]\n    s = sessions(user, ts, 20)\n    assert_true(s.session_index[3] == 0 and s.session_start[3] == 0)\n    t = sessions(user, ts, 19)\n    assert_true(t.session_index[3] == 1 and t.session_start[3] == 30)\n    assert_true(s.n_prev_in_session[1] == 1 and s.n_prev_in_session[2] == 1 and s.n_prev_in_session[3] == 3)\n    assert_true(s.session_index[4] == 0 and s.n_prev_in_session[4] == 0)\n}\n\n# SPDX-License-Identifier: MIT OR Apache-2.0\n# SPDX-FileCopyrightText: 2026 The Viv authors\n"},{"name":"./rows","path":"catalog/rows.viv","lines":46,"src":"# Row groups shared by the catalog's features: rows sorted by (key, ts).\n\n#| The end (exclusive) of the key group that starts at row `start`, after\n#| checking that the rows are sorted by (key, ts); `who` names the caller in\n#| the error.\n#: key  the entity key of each row\n#: ts  each row's time, int64 nanoseconds\n#: start  the first row of the group\n#@ 2c0afca7\ndef group_end(key: [Int], ts: [Int], start: Int, who: Str) -> Int {\n    n = len(ts)\n    stop_at: Int = start + 1\n    while stop_at < n and key[stop_at] == key[start] {\n        if ts[stop_at] < ts[stop_at - 1] {\n            stop(f\"{who}: rows must be sorted by (key, ts); row {stop_at} goes back in time\")\n        }\n        stop_at += 1\n    }\n    if stop_at < n and key[stop_at] < key[start] {\n        stop(f\"{who}: rows must be sorted by (key, ts); the key falls at row {stop_at}\")\n    }\n    return stop_at\n}\n\n#| The end (exclusive) of the run of rows at row `i`'s instant, within a group\n#| ending at `stop_at`.\n#: i  the first row of the instant\n#: stop_at  the end of the key group\n#@ 9ee224e9\ndef instant_end(ts: [Int], i: Int, stop_at: Int) -> Int {\n    j: Int = i\n    while j < stop_at and ts[j] == ts[i] {\n        j += 1\n    }\n    return j\n}\n\ntest \"groups and instants\" {\n    key: [Int] = [1, 1, 1, 2]\n    ts: [Int] = [5, 5, 7, 0]\n    assert_true(group_end(key, ts, 0, \"t\") == 3 and group_end(key, ts, 3, \"t\") == 4)\n    assert_true(instant_end(ts, 0, 3) == 2 and instant_end(ts, 2, 3) == 3)\n}\n\n# SPDX-License-Identifier: MIT OR Apache-2.0\n# SPDX-FileCopyrightText: 2026 The Viv authors\n"}],"defs":[{"id":"sessions","module":0,"line":37,"end":73,"params":["user","ts","gap"],"doc":"Gap-based sessions for events sorted by (user, ts): each row's session start,\nthe session's index within the user, the seconds since the session started and\nthe number of earlier events in the session.\nOne pass per user, one instant at a time: a gap longer than `gap` before an\ninstant closes the session.\nA session id built from a global running counter would change when an\nearlier user gains sessions in the future; the start time does not.\nuser  the entity key, sorted ascending\nts  event time, int64 nanoseconds, ascending within a user\ngap  the longest gap, in nanoseconds, that keeps a session open\n@ 27f60b7d","intent":"Gap-based sessions for events sorted by (user, ts): each row's session start, the session's index within the user, the seconds since the session started and the number of earlier events in the session.","dist":0,"from":null,"steps":[{"id":"split","text":"a gap longer than the limit opens a new session","line":52,"end":58},{"id":"fill","text":"the rows of the instant share the session and its past","line":59,"end":67}],"loops":[{"line":44,"end":71,"depth":1,"head":"while g < n"},{"line":50,"end":69,"depth":2,"head":"while i < stop_at"},{"line":60,"end":65,"depth":3,"head":"for k from i to same"}],"calls":[["group_end",45,1,0],["instant_end",51,2,0]],"indirect":[],"builtins":{"float":2,"int_zeros":3,"len":1,"zeros":1}},{"id":"group_end","module":1,"line":10,"end":23,"params":["key","ts","start","who"],"doc":"The end (exclusive) of the key group that starts at row `start`, after\nchecking that the rows are sorted by (key, ts); `who` names the caller in\nthe error.\nkey  the entity key of each row\nts  each row's time, int64 nanoseconds\nstart  the first row of the group\n@ 2c0afca7","intent":"The end (exclusive) of the key group that starts at row `start`, after checking that the rows are sorted by (key, ts); `who` names the caller in the error.","dist":1,"from":"sessions","steps":[],"loops":[{"line":13,"end":18,"depth":1,"head":"while stop_at < n and key[stop_at] == key[start]"}],"calls":[],"indirect":[],"builtins":{"len":1,"stop":2}},{"id":"instant_end","module":1,"line":30,"end":36,"params":["ts","i","stop_at"],"doc":"The end (exclusive) of the run of rows at row `i`'s instant, within a group\nending at `stop_at`.\ni  the first row of the instant\nstop_at  the end of the key group\n@ 9ee224e9","intent":"The end (exclusive) of the run of rows at row `i`'s instant, within a group ending at `stop_at`.","dist":1,"from":"sessions","steps":[],"loops":[{"line":32,"end":34,"depth":1,"head":"while j < stop_at and ts[j] == ts[i]"}],"calls":[],"indirect":[],"builtins":{}}],"contracts":[]}
