{"root":"examples/options/crr","entry":"crr_price","defsInProgram":2,"modules":[{"name":"examples/options/crr","path":"examples/options/crr.viv","lines":63,"src":"#|| The Cox-Ross-Rubinstein binomial tree (J. Financial Economics 7, 1979)\n#|| for European and American calls and puts on a stock with continuous\n#|| dividend yield q.\n\n#| The CRR value with N steps: u = exp(sigma sqrt(dt)), d = 1/u, the\n#| risk-neutral up probability p = (exp((r - q) dt) - d) / (u - d), values\n#| rolled back from maturity; an American option takes the larger of\n#| continuing and exercising at every node.\ndef crr_price(S: Num, K: Num, T: Num, r: Num, q: Num, sigma: Num, N: Int, is_call: Bool, american: Bool) -> Num {\n    dt = T / N\n    u = exp(sigma * sqrt(dt))\n    d = 1.0 / u\n    p = (exp((r - q) * dt) - d) / (u - d)\n    disc = exp(-r * dt)\n    pu = disc * p\n    pd = disc * (1.0 - p)\n    sgn = 1.0 if is_call else -1.0\n    # pw[k] = u^(k - N), so the price at step i, j ups is S pw[2j - i + N]\n    pw = zeros(2 * N + 1)\n    for k to 2 * N + 1 {\n        pw[k] = exp(sigma * sqrt(dt) * (k - N))\n    }\n    v = zeros(N + 1)\n    for j to N + 1 {\n        v[j] = max(sgn * (S * pw[2 * j]  - K), 0.0)\n    }\n    for i from 0 to N reversed {\n        for j to i + 1 {\n            cont = pu * v[j + 1] + pd * v[j]\n            if american {\n                v[j] = max(cont, sgn * (S * pw[2 * j - i + N] - K))\n            }\n            else {\n                v[j] = cont\n            }\n        }\n    }\n    return v[0]\n}\n\n#| crr_price over arrays of options (S, K, T, sigma, is_call of one length;\n#| is_call is 1 for a call, 0 for a put), all with N steps.\ndef crr_prices(S: Arr, K: Arr, T: Arr, r: Num, q: Num, sigma: Arr, is_call: Arr, N: Int, american: Bool) -> Arr {\n    n = len(S)\n    out = zeros(n)\n    for i to n {\n        out[i] = crr_price(S[i], K[i], T[i], r, q, sigma[i], N, is_call[i] > 0.5, american)\n    }\n    return out\n}\n\ntest \"Hull's American put, S=K=50, r=10%, sigma=40%, T=5 months, 5 steps: 4.49\" {\n    assert_near(crr_price(50.0, 50.0, 5.0 / 12.0, 0.1, 0.0, 0.4, 5, false, true), 4.49, 0.005)\n}\n\ntest \"an American call without dividends is the European call\" {\n    a = crr_price(100.0, 95.0, 1.0, 0.05, 0.0, 0.25, 200, true, true)\n    e = crr_price(100.0, 95.0, 1.0, 0.05, 0.0, 0.25, 200, true, false)\n    assert_near(a, e, 1.0e-12)\n}\n\n# SPDX-License-Identifier: MIT OR Apache-2.0\n# SPDX-FileCopyrightText: 2026 The Viv authors\n"}],"defs":[{"id":"crr_price","module":0,"line":9,"end":39,"params":["S","K","T","r","q","sigma","N","is_call","american"],"doc":"The CRR value with N steps: u = exp(sigma sqrt(dt)), d = 1/u, the\nrisk-neutral up probability p = (exp((r - q) dt) - d) / (u - d), values\nrolled back from maturity; an American option takes the larger of\ncontinuing and exercising at every node.","intent":"The CRR value with N steps: u = exp(sigma sqrt(dt)), d = 1/u, the risk-neutral up probability p = (exp((r - q) dt) - d) / (u - d), values rolled back from maturity; an American option takes the larger of continuing and exercising at every node.","dist":0,"from":null,"steps":[],"loops":[{"line":20,"end":22,"depth":1,"head":"for k to 2 * N + 1"},{"line":24,"end":26,"depth":1,"head":"for j to N + 1"},{"line":27,"end":37,"depth":1,"head":"for i from 0 to N reversed"},{"line":28,"end":36,"depth":2,"head":"for j to i + 1"}],"calls":[],"indirect":[],"builtins":{"ceil":1,"exp":4,"max":2,"sqrt":2,"zeros":2}}],"contracts":[]}
