{"root":"lib/cartpole_api","entry":"cartpole_model","defsInProgram":7,"modules":[{"name":"lib/cartpole_api","path":"lib/cartpole_api.viv","lines":72,"src":"###\npost: the cart-pole's entry points for Python (vipyr)\nagent: claude\n\nTyped wrappers over lib/cartpole.viv, so that `vipyr.load` exports them as\nPython functions taking and returning NumPy arrays: the model linearized about\nthe upright, and a closed-loop run of the nonlinear model under a gain K.\nvp.control.cartpole_model and vp.control.simulate are these two defs.\n###\n\nfrom cartpole import cartpole_rate, cartpole_step\n\n# the state: cart position, cart velocity, pole angle, pole angular rate\nNSTATE = 4\n# the columns of a simulated trajectory: time, the four states, the force\nNCOLS = 6\n\n#| The cart-pole linearized about the upright: A = df/ds (4 by 4) and B = df/du\n#| (4 by 1), by central differences of step h on the nonlinear dynamics, so the\n#| linear model is the one the simulation runs.\ndef cartpole_model(h: Num) {\n    a = zeros(NSTATE, NSTATE)\n    for j to NSTATE {\n        sp = zeros(NSTATE)\n        sm = zeros(NSTATE)\n        sp[j] = h\n        sm[j] = -h\n        fp = cartpole_rate(sp, 0.0)\n        fm = cartpole_rate(sm, 0.0)\n        for i to NSTATE {\n            a[i, j] = (fp[i] - fm[i]) / (2.0 * h)\n        }\n    }\n    b = zeros(NSTATE, 1)\n    s0 = zeros(NSTATE)\n    fp = cartpole_rate(s0, h)\n    fm = cartpole_rate(s0, -h)\n    for i to NSTATE {\n        b[i, 0] = (fp[i] - fm[i]) / (2.0 * h)\n    }\n    return a, b\n}\n\n#| The nonlinear cart-pole under the state feedback u = -K s, from the state s0\n#| for `steps` steps of dt (fourth-order Runge-Kutta, the force held over each\n#| step). One row per time: t, x, xdot, theta, thetadot, u.\ndef cartpole_simulate(K: Arr, s0: Arr, dt: Num, steps: Int) -> Arr {\n    out = zeros(steps + 1, NCOLS)\n    s = s0\n    for n to steps + 1 {\n        u = -dot(K, s)\n        out[n, 0] = n * dt\n        for i to NSTATE {\n            out[n, i + 1] = s[i]\n        }\n        out[n, NCOLS - 1] = u\n        if n < steps {\n            s = cartpole_step(s, u, dt)\n        }\n    }\n    return out\n}\n\ntest \"near upright the nonlinear rate equals A s, to 1e-10\" {\n    a, b = cartpole_model(1.0e-5)\n    s = [0.0, 0.0, 1.0e-4, 0.0]\n    f = cartpole_rate(s, 0.0)\n    assert_near(f[3], a[3, 2] * 1.0e-4, 1.0e-10)\n}\n\n# SPDX-License-Identifier: MIT OR Apache-2.0\n# SPDX-FileCopyrightText: 2026 The Viv authors\n"},{"name":"lib/cartpole","path":"lib/cartpole.viv","lines":87,"src":"#! post Cart-pole: the dynamics, a step, and the drawing\n#| The cart-pole of Barto, Sutton and Anderson (1983): a cart of mass CART_M on a frictionless\n#| track, a pole of mass POLE_M and half-length POLE_L hinged on it. The state is\n#| [x, xdot, theta, thetadot], with theta = 0 the pole upright and theta > 0 leaning to the right.\n#| Use it with `import cartpole`: a controller returns a force, cartpole_step advances the\n#| state, cartpole_draw puts the cart, the pole and its bob on the stage.\n\nCART_M = 1.0\nPOLE_M = 0.1\nPOLE_L = 0.5\nGRAVITY = 9.81\n\n#| The accelerations [xdd, thetadd] for a state and a horizontal force on the cart.\ndef cartpole_accel(s, force, gravity = GRAVITY) {\n    th = s[2]\n    thd = s[3]\n    total = CART_M + POLE_M\n    sn = sin(th)\n    cs = cos(th)\n    tmp = (force + POLE_M * POLE_L * thd * thd * sn) / total\n    thdd = (gravity * sn - cs * tmp) / (POLE_L * (4.0 / 3.0 - POLE_M * cs * cs / total))\n    xdd = tmp - POLE_M * POLE_L * thdd * cs / total\n    return [xdd, thdd]\n}\n\n#| The time derivative of the state.\ndef cartpole_rate(s, force) {\n    a = cartpole_accel(s, force)\n    return [s[1], a[0], s[3], a[1]]\n}\n\n#| One step of dt by fourth-order Runge-Kutta, the force held for the step.\ndef cartpole_step(s, force, dt) {\n    k1 = cartpole_rate(s, force)\n    k2 = cartpole_rate(s + 0.5 * dt * k1, force)\n    k3 = cartpole_rate(s + 0.5 * dt * k2, force)\n    k4 = cartpole_rate(s + dt * k3, force)\n    return s + (dt / 6.0) * (k1 + 2.0 * k2 + 2.0 * k3 + k4)\n}\n\n#| The mechanical energy, with the pole's rotational inertia (1/3) m L^2 about the hinge.\ndef cartpole_energy(s) {\n    xd = s[1]\n    th = s[2]\n    thd = s[3]\n    bob_vx = xd + POLE_L * thd * cos(th)\n    bob_vy = -POLE_L * thd * sin(th)\n    kinetic = 0.5 * CART_M * xd * xd + 0.5 * POLE_M * (bob_vx * bob_vx + bob_vy * bob_vy) + 0.5 * (POLE_M * POLE_L * POLE_L / 3.0) * thd * thd\n    return kinetic + POLE_M * GRAVITY * POLE_L * cos(th)\n}\n\n#| Draw the cart, the pole and its bob for a state, on a stage whose window is in meters.\ndef cartpole_draw(s) {\n    x = s[0]\n    th = s[2]\n    tip_x = x + 2.0 * POLE_L * sin(th)\n    tip_y = 0.12 + 2.0 * POLE_L * cos(th)\n    rect(\"cart\", x, 0.06, 0.36, 0.14, 0.0)\n    segment(\"pole\", x, 0.12, tip_x, tip_y)\n    circle(\"bob\", tip_x, tip_y, 0.05)\n}\n\ntest \"with no force the cart-pole conserves energy: a free swing from 60 degrees drifts by less than a part in a million\" {\n    s = [0.0, 0.0, 1.0471975511965976, 0.0]\n    e0 = cartpole_energy(s)\n    steps = 400.0\n    for k to steps {\n        s = cartpole_step(s, 0.0, 0.005)\n    }\n    assert_near(cartpole_energy(s), e0, 1.0e-6 * abs(e0))\n}\ntest \"hanging straight down it stays there; balanced upright it falls\" {\n    down = [0.0, 0.0, 3.141592653589793, 0.0]\n    steps = 200.0\n    for k to steps {\n        down = cartpole_step(down, 0.0, 0.01)\n    }\n    assert_near(down[2], 3.141592653589793, 1.0e-9)\n    up = [0.0, 0.0, 0.01, 0.0]\n    for k to steps {\n        up = cartpole_step(up, 0.0, 0.01)\n    }\n    assert_gt(abs(up[2]), 0.5)\n}\n\n# SPDX-License-Identifier: MIT OR Apache-2.0\n# SPDX-FileCopyrightText: 2026 The Viv authors\n"}],"defs":[{"id":"cartpole_model","module":0,"line":21,"end":42,"params":["h"],"doc":"The cart-pole linearized about the upright: A = df/ds (4 by 4) and B = df/du\n(4 by 1), by central differences of step h on the nonlinear dynamics, so the\nlinear model is the one the simulation runs.","intent":"The cart-pole linearized about the upright: A = df/ds (4 by 4) and B = df/du (4 by 1), by central differences of step h on the nonlinear dynamics, so the linear model is the one the simulation runs.","dist":0,"from":null,"steps":[],"loops":[{"line":23,"end":33,"depth":1,"head":"for j to NSTATE"},{"line":30,"end":32,"depth":2,"head":"for i to NSTATE"},{"line":38,"end":40,"depth":1,"head":"for i to NSTATE"}],"calls":[["cartpole_rate",28,1,0],["cartpole_rate",29,1,0],["cartpole_rate",36,0,0],["cartpole_rate",37,0,0]],"indirect":[],"builtins":{"zeros":5}},{"id":"cartpole_rate","module":1,"line":27,"end":30,"params":["s","force"],"doc":"The time derivative of the state.","intent":"The time derivative of the state.","dist":1,"from":"cartpole_model","steps":[],"loops":[],"calls":[["cartpole_accel",28,0,0]],"indirect":[],"builtins":{}},{"id":"cartpole_accel","module":1,"line":14,"end":24,"params":["s","force","gravity"],"doc":"The accelerations [xdd, thetadd] for a state and a horizontal force on the cart.","intent":"The accelerations [xdd, thetadd] for a state and a horizontal force on the cart.","dist":2,"from":"cartpole_rate","steps":[],"loops":[],"calls":[],"indirect":[],"builtins":{"cos":1,"sin":1}}],"contracts":[]}
