{"root":"examples/options/cnpde","entry":"cn_american_put","defsInProgram":3,"modules":[{"name":"examples/options/cnpde","path":"examples/options/cnpde.viv","lines":144,"src":"#|| Crank-Nicolson finite differences for the Black-Scholes equation, in the\n#|| time to expiry tau: V_tau = 1/2 sigma^2 S^2 V_SS + (r - q) S V_S - r V.\n#|| The first steps are fully implicit (Rannacher, Numer. Math. 43, 1984),\n#|| which damps the oscillation the kinked payoff sets off in Crank-Nicolson.\n#|| An American put solves the linear complementarity problem at each step\n#|| by the Brennan-Schwartz sweep (J. Finance 32, 1977): eliminate from large\n#|| S down, then substitute up with the early-exercise floor.\n\n# Quadratic interpolation of the grid values at x, from the three nodes\n# nearest it.\ndef _interp(S0: Num, lo: Num, dS: Num, v: Arr) -> Num {\n    m: Int = int(len(v))\n    i: Int = int(floor((S0 - lo) / dS + 0.5))\n    if i < 1 {\n        i = 1\n    }\n    if i > m - 2 {\n        i = m - 2\n    }\n    t = (S0 - lo) / dS - i\n    return v[i - 1] * 0.5 * t * (t - 1.0) + v[i] * (1.0 - t * t) + v[i + 1] * 0.5 * t * (t + 1.0)\n}\n\n#| The American put by Crank-Nicolson on M space intervals over [0, Smax]\n#| and Nt time steps, of which the first `implicit` are fully implicit\n#| (two half-size steps each).\ndef cn_american_put(S0: Num, K: Num, T: Num, r: Num, q: Num, sigma: Num, Smax: Num, M: Int, Nt: Int, implicit: Int) -> Num {\n    dS = Smax / M\n    v = zeros(M + 1)\n    pay = zeros(M + 1)\n    for i to M + 1 {\n        pay[i] = max(K - i * dS, 0.0)\n        v[i] = pay[i]\n    }\n    a = zeros(M + 1)\n    b = zeros(M + 1)\n    c = zeros(M + 1)\n    for i to M + 1 {\n        a[i] = 0.5 * sigma * sigma * i * i - 0.5 * (r - q) * i\n        b[i] = -sigma * sigma * i * i - r\n        c[i] = 0.5 * sigma * sigma * i * i + 0.5 * (r - q) * i\n    }\n    dt = T / Nt\n    bp = zeros(M + 1)\n    dp = zeros(M + 1)\n    rhs = zeros(M + 1)\n    nsteps = Nt + implicit\n    for n to nsteps {\n        theta = 0.5\n        h = dt\n        if n < 2 * implicit {\n            theta = 1.0\n            h = 0.5 * dt\n        }\n        # the right side: (I + (1 - theta) h L) v\n        for i from 1 to M {\n            rhs[i] = v[i] + (1.0 - theta) * h * (a[i] * v[i - 1] + b[i] * v[i] + c[i] * v[i + 1])\n        }\n        # boundaries: V(0) = K (exercised at once), V(Smax) = 0\n        v0 = K\n        rhs[1] = rhs[1] + theta * h * a[1] * v0\n        # the left side I - theta h L, eliminated from the top down\n        bp[M - 1] = 1.0 - theta * h * b[M - 1]\n        dp[M - 1] = rhs[M - 1]\n        for i from 1 to M - 1 reversed {\n            mlt = (-theta * h * c[i]) / bp[i + 1]\n            bp[i] = 1.0 - theta * h * b[i] - mlt * (-theta * h * a[i + 1])\n            dp[i] = rhs[i] - mlt * dp[i + 1]\n        }\n        v[0] = v0\n        for i from 1 to M {\n            x = (dp[i] - (-theta * h * a[i]) * v[i - 1]) / bp[i]\n            v[i] = max(x, pay[i])\n        }\n        v[M] = 0.0\n    }\n    return _interp(S0, 0.0, Smax / M, v)\n}\n\n#| A European down-and-out call (barrier H below the strike, no rebate) by\n#| Crank-Nicolson on [H, Smax], V(H) = 0, with M intervals and Nt steps,\n#| the first `implicit` fully implicit.\ndef cn_down_out_call(S0: Num, K: Num, H: Num, T: Num, r: Num, q: Num, sigma: Num, Smax: Num, M: Int, Nt: Int, implicit: Int) -> Num {\n    dS = (Smax - H) / M\n    v = zeros(M + 1)\n    for i to M + 1 {\n        v[i] = max(H + i * dS - K, 0.0)\n    }\n    a = zeros(M + 1)\n    b = zeros(M + 1)\n    c = zeros(M + 1)\n    for i to M + 1 {\n        x = (H + i * dS) / dS\n        a[i] = 0.5 * sigma * sigma * x * x - 0.5 * (r - q) * x\n        b[i] = -sigma * sigma * x * x - r\n        c[i] = 0.5 * sigma * sigma * x * x + 0.5 * (r - q) * x\n    }\n    dt = T / Nt\n    n_in = M - 1\n    sub = zeros(n_in)\n    dia = zeros(n_in)\n    sup = zeros(n_in)\n    rhs = zeros(n_in)\n    tau = 0.0\n    nsteps = Nt + implicit\n    for n to nsteps {\n        theta = 0.5\n        h = dt\n        if n < 2 * implicit {\n            theta = 1.0\n            h = 0.5 * dt\n        }\n        tau += h\n        top = Smax * exp(-q * tau) - K * exp(-r * tau)\n        for k to n_in {\n            i = k + 1\n            rhs[k] = v[i] + (1.0 - theta) * h * (a[i] * v[i - 1] + b[i] * v[i] + c[i] * v[i + 1])\n            sub[k] = -theta * h * a[i]\n            dia[k] = 1.0 - theta * h * b[i]\n            sup[k] = -theta * h * c[i]\n        }\n        rhs[n_in - 1] = rhs[n_in - 1] + theta * h * c[M - 1] * top\n        inner = tridiag_solve(sub, dia, sup, rhs)\n        v[0] = 0.0\n        for k to n_in {\n            v[k + 1] = inner[k]\n        }\n        v[M] = top\n    }\n    return _interp(S0, H, dS, v)\n}\n\ntest \"Longstaff and Schwartz's first American put (S=36, K=40): binomial 4.48668\" {\n    p = cn_american_put(36.0, 40.0, 1.0, 0.06, 0.0, 0.2, 160.0, 800, 400, 2)\n    assert_near(p, 4.48668, 1.0e-3)\n}\n\ntest \"a barrier far below the money changes almost nothing\" {\n    c = cn_down_out_call(100.0, 100.0, 20.0, 1.0, 0.05, 0.0, 0.2, 400.0, 760, 400, 2)\n    assert_near(c, 10.450583572185565, 1.0e-3)\n}\n\n# SPDX-License-Identifier: MIT OR Apache-2.0\n# SPDX-FileCopyrightText: 2026 The Viv authors\n"}],"defs":[{"id":"cn_american_put","module":0,"line":27,"end":78,"params":["S0","K","T","r","q","sigma","Smax","M","Nt","implicit"],"doc":"The American put by Crank-Nicolson on M space intervals over [0, Smax]\nand Nt time steps, of which the first `implicit` are fully implicit\n(two half-size steps each).","intent":"The American put by Crank-Nicolson on M space intervals over [0, Smax] and Nt time steps, of which the first `implicit` are fully implicit (two half-size steps each).","dist":0,"from":null,"steps":[],"loops":[{"line":31,"end":34,"depth":1,"head":"for i to M + 1"},{"line":38,"end":42,"depth":1,"head":"for i to M + 1"},{"line":48,"end":76,"depth":1,"head":"for n to nsteps"},{"line":56,"end":58,"depth":2,"head":"for i from 1 to M"},{"line":65,"end":69,"depth":2,"head":"for i from 1 to M - 1 reversed"},{"line":71,"end":74,"depth":2,"head":"for i from 1 to M"}],"calls":[["_interp",77,0,0]],"indirect":[],"builtins":{"ceil":1,"max":2,"zeros":8}},{"id":"_interp","module":0,"line":11,"end":22,"params":["S0","lo","dS","v"],"doc":"Quadratic interpolation of the grid values at x, from the three nodes\nnearest it.","intent":"","dist":1,"from":"cn_american_put","steps":[],"loops":[],"calls":[],"indirect":[],"builtins":{"floor":1,"int":2,"len":1}}],"contracts":[]}
