{"root":"examples/options/heston","entry":"heston_cos","defsInProgram":4,"modules":[{"name":"examples/options/heston","path":"examples/options/heston.viv","lines":95,"src":"#|| European options under the Heston model by the COS method of Fang and\n#|| Oosterlee (SIAM J. Sci. Comput. 31, 2008): the density of\n#|| y = log(S_T / K) is expanded in a cosine series on [a, b], whose\n#|| coefficients come from the characteristic function in closed form.\n#||\n#|| Parameters: v0 the initial variance, kappa the speed of mean reversion,\n#|| theta the long-run variance, eta the volatility of variance, rho the\n#|| correlation of the two Brownian motions.\n\nPI = 3.141592653589793\n\n#| The characteristic function of log(S_T / S_0), E exp(i u log(S_T / S_0)),\n#| in the form that keeps the complex logarithm on its principal branch\n#| (Albrecher, Mayer, Schoutens and Tistaert, \"The little Heston trap\", 2007).\ndef heston_cf(u: Num, T: Num, r: Num, q: Num, v0: Num, kappa: Num, theta: Num, eta: Num, rho: Num) -> Complex {\n    iu = u * 1.0i\n    beta = kappa - rho * eta * iu\n    D = sqrt(beta * beta + eta * eta * (u * u + iu))\n    G = (beta - D) / (beta + D)\n    e = exp(-D * T)\n    C = kappa * theta / (eta * eta) * ((beta - D) * T - 2.0 * log((1.0 - G * e) / (1.0 - G)))\n    B = (beta - D) / (eta * eta) * (1.0 - e) / (1.0 - G * e)\n    return exp(iu * (r - q) * T + C + B * v0)\n}\n\n# The first cumulant of log(S_T / S_0), its mean (Fang and Oosterlee, Table 11).\ndef _c1(T: Num, r: Num, q: Num, v0: Num, kappa: Num, theta: Num) -> Num {\n    return (r - q) * T + (1.0 - exp(-kappa * T)) * (theta - v0) / (2.0 * kappa) - 0.5 * theta * T\n}\n\n# The second cumulant, -d^2/du^2 log phi(u) at u = 0, by a central\n# difference of the characteristic function (h = 1e-4: relative error near\n# 1e-8, ample for a truncation width)\ndef _c2(T: Num, r: Num, q: Num, v0: Num, kappa: Num, theta: Num, eta: Num, rho: Num) -> Num {\n    h = 1.0e-4\n    lp = log(heston_cf(h, T, r, q, v0, kappa, theta, eta, rho))\n    lm = log(heston_cf(-h, T, r, q, v0, kappa, theta, eta, rho))\n    return -re(lp + lm) / (h * h)\n}\n\n#| Heston prices of European options on one stock for an array of strikes,\n#| with N cosine terms and the truncation half-width L standard deviations.\n#| The put comes from the series (its payoff is bounded) and the call from\n#| put-call parity, as Fang and Oosterlee recommend. is_call: 1 call, 0 put.\ndef heston_cos(S: Num, K: Arr, T: Num, r: Num, q: Num, v0: Num, kappa: Num, theta: Num, eta: Num, rho: Num, N: Int, L: Num, is_call: Arr) -> Arr {\n    c1 = _c1(T, r, q, v0, kappa, theta)\n    w = L * sqrt(abs(_c2(T, r, q, v0, kappa, theta, eta, rho)))\n    bma = 2.0 * w\n    # the characteristic function at u_k = k pi / (b - a): b - a is the\n    # same for every strike, so these are shared\n    phi = czeros(N)\n    for k to N {\n        phi[k] = heston_cf(k * PI / bma, T, r, q, v0, kappa, theta, eta, rho)\n    }\n    nk = len(K)\n    out = zeros(nk)\n    for j to nk {\n        x = log(S / K[j])\n        a = x + c1 - w\n        total = 0.0\n        for k to N {\n            uk = k * PI / bma\n            # the put's payoff coefficient U_k = 2 / (b - a) (psi_k(a, 0) - chi_k(a, 0))\n            cd = cos(-uk * a)\n            sd = sin(-uk * a)\n            chi = (cd - exp(a) + uk * sd) / (1.0 + uk * uk)\n            psi = -a\n            if k > 0 {\n                psi = sd / uk\n            }\n            Uk = 2.0 / bma * (psi - chi)\n            term = re(phi[k] * exp(uk * (x - a) * 1.0i)) * Uk\n            if k == 0 {\n                term = 0.5 * term\n            }\n            total += term\n        }\n        put = K[j] * exp(-r * T) * total\n        if is_call[j] > 0.5 {\n            out[j] = put + S * exp(-q * T) - K[j] * exp(-r * T)\n        }\n        else {\n            out[j] = put\n        }\n    }\n    return out\n}\n\ntest \"Fang and Oosterlee's Heston call, T = 1: 5.785155450\" {\n    p = heston_cos(100.0, [100.0], 1.0, 0.0, 0.0, 0.0175, 1.5768, 0.0398, 0.5751, -0.5711, 1024, 32.0, [1.0])\n    assert_near(p[0], 5.785155450, 2.0e-8)\n}\n\n# SPDX-License-Identifier: MIT OR Apache-2.0\n# SPDX-FileCopyrightText: 2026 The Viv authors\n"}],"defs":[{"id":"heston_cos","module":0,"line":45,"end":87,"params":["S","K","T","r","q","v0","kappa","theta","eta","rho","N","L","is_call"],"doc":"Heston prices of European options on one stock for an array of strikes,\nwith N cosine terms and the truncation half-width L standard deviations.\nThe put comes from the series (its payoff is bounded) and the call from\nput-call parity, as Fang and Oosterlee recommend. is_call: 1 call, 0 put.","intent":"Heston prices of European options on one stock for an array of strikes, with N cosine terms and the truncation half-width L standard deviations. The put comes from the series (its payoff is bounded) and the call from put-call parity, as Fang and Oosterlee recommend. is_call: 1 call, 0 put.","dist":0,"from":null,"steps":[],"loops":[{"line":52,"end":54,"depth":1,"head":"for k to N"},{"line":57,"end":85,"depth":1,"head":"for j to nk"},{"line":61,"end":77,"depth":2,"head":"for k to N"}],"calls":[["_c1",46,0,0],["_c2",47,0,0],["heston_cf",53,1,0]],"indirect":[],"builtins":{"abs":1,"cos":1,"czeros":1,"exp":5,"len":1,"log":1,"re":1,"sin":1,"sqrt":1,"zeros":1}},{"id":"_c1","module":0,"line":27,"end":29,"params":["T","r","q","v0","kappa","theta"],"doc":"The first cumulant of log(S_T / S_0), its mean (Fang and Oosterlee, Table 11).","intent":"","dist":1,"from":"heston_cos","steps":[],"loops":[],"calls":[],"indirect":[],"builtins":{"exp":1}},{"id":"_c2","module":0,"line":34,"end":39,"params":["T","r","q","v0","kappa","theta","eta","rho"],"doc":"The second cumulant, -d^2/du^2 log phi(u) at u = 0, by a central\ndifference of the characteristic function (h = 1e-4: relative error near\n1e-8, ample for a truncation width)","intent":"","dist":1,"from":"heston_cos","steps":[],"loops":[],"calls":[["heston_cf",36,0,0],["heston_cf",37,0,0]],"indirect":[],"builtins":{"log":2,"re":1}},{"id":"heston_cf","module":0,"line":15,"end":24,"params":["u","T","r","q","v0","kappa","theta","eta","rho"],"doc":"The characteristic function of log(S_T / S_0), E exp(i u log(S_T / S_0)),\nin the form that keeps the complex logarithm on its principal branch\n(Albrecher, Mayer, Schoutens and Tistaert, \"The little Heston trap\", 2007).","intent":"The characteristic function of log(S_T / S_0), E exp(i u log(S_T / S_0)), in the form that keeps the complex logarithm on its principal branch (Albrecher, Mayer, Schoutens and Tistaert, \"The little Heston trap\", 2007).","dist":1,"from":"heston_cos","steps":[],"loops":[],"calls":[],"indirect":[],"builtins":{"exp":2,"log":1,"sqrt":1}}],"contracts":[]}
