{"root":"catalog/streaks","entry":"streaks","defsInProgram":4,"modules":[{"name":"catalog/streaks","path":"catalog/streaks.viv","lines":101,"src":"# Streaks: consecutive active days per user.\n#\n# Input: one row per event, sorted by (user, ts); ts in int64 nanoseconds.\n# A row's day is floor(ts / 1 day), in UTC. A day is active for a user when\n# the user has at least one event on it. For a row on day D:\n#\n#   streak_days   the number of consecutive active days ending on D (D counts:\n#                 the row itself makes D active)\n#   longest_90d   the longest run of consecutive active days inside the 90\n#                 days D-89 .. D, a run that began before D-89 cut at D-89\n#\n# Both read only the user's events on days <= D, and every row of a day gets\n# the same values.\n\nfrom rows import group_end\n\nNS_PER_S: Int = 1000000000\nDAY: Int = 86400 * NS_PER_S\nWINDOW_DAYS: Int = 90\n\nrecord Streaks {\n    streak_days: [Int]\n    longest_90d: [Int]\n}\n\n#| The current streak of active days and the longest streak inside the trailing\n#| window of days, for events sorted by (user, ts).\n#|| The user's distinct active days are kept in order with the length of the run\n#|| that ends on each; the window's longest run is a scan back over them.\n#||| The current streak has no lookback limit: serving it needs the user's whole\n#||| run of days, while the windowed one needs only the window.\n#: user  the entity key, sorted ascending\n#: ts  event time, int64 nanoseconds, ascending within a user\n#@ 3b3c8dc8\ndef streaks(user: [Int], ts: [Int]) -> Streaks {\n    n = len(ts)\n    cur = int_zeros(n)\n    best = int_zeros(n)\n    g: Int = 0\n    while g < n {\n        stop_at = group_end(user, ts, g, \"streaks\")\n        days: [Int] = []\n        runs: [Int] = []\n        for i from g to stop_at {\n            d = day_of(ts[i])\n            step extend \"the row's day joins the list of active days\" {\n                m = len(days)\n                if m == 0 or days[m - 1] < d {\n                    run: Int = 1\n                    if m > 0 and days[m - 1] == d - 1 {\n                        run = runs[m - 1] + 1\n                    }\n                    days = append(days, d)\n                    runs = append(runs, run)\n                }\n            }\n            step window \"the longest run inside days d - 89 .. d\" {\n                lo = d - WINDOW_DAYS + 1\n                longest: Int = 0\n                k: Int = len(days) - 1\n                while k >= 0 and days[k] >= lo {\n                    longest = max(longest, min(runs[k], days[k] - lo + 1))\n                    k -= 1\n                }\n            }\n            cur[i] = runs[len(runs) - 1]\n            best[i] = longest\n        }\n        g = stop_at\n    }\n    return Streaks { streak_days: cur, longest_90d: best }\n}\n\n#| The UTC day number of a time in nanoseconds, rounded down (floor division,\n#| so times before the epoch fall on negative days).\n#: t  a time, int64 nanoseconds since the epoch\n#@ 195681a7\ndef day_of(t: Int) -> Int {\n    return t // DAY\n}\n\ntest \"a streak counts back over consecutive days and the window cuts it\" {\n    user: [Int] = [1, 1, 1, 1, 1]\n    ts: [Int] = [0, DAY, DAY + 5, 2 * DAY, 100 * DAY]\n    s = streaks(user, ts)\n    assert_true(s.streak_days[0] == 1 and s.streak_days[2] == 2 and s.streak_days[3] == 3)\n    assert_true(s.streak_days[4] == 1 and s.longest_90d[3] == 3 and s.longest_90d[4] == 1)\n    assert_true(day_of(-1) == -1 and day_of(DAY) == 1)\n}\n\ntest \"a run that began before the window is cut at the window's first day\" {\n    user: [Int] = [4, 4, 4]\n    ts: [Int] = [0, DAY, 90 * DAY]\n    s = streaks(user, ts)\n    assert_true(s.longest_90d[2] == 1)\n    t = streaks(user, [0, DAY, 2 * DAY])\n    assert_true(t.longest_90d[2] == 3)\n}\n\n# SPDX-License-Identifier: MIT OR Apache-2.0\n# SPDX-FileCopyrightText: 2026 The Viv authors\n"},{"name":"./rows","path":"catalog/rows.viv","lines":46,"src":"# Row groups shared by the catalog's features: rows sorted by (key, ts).\n\n#| The end (exclusive) of the key group that starts at row `start`, after\n#| checking that the rows are sorted by (key, ts); `who` names the caller in\n#| the error.\n#: key  the entity key of each row\n#: ts  each row's time, int64 nanoseconds\n#: start  the first row of the group\n#@ 2c0afca7\ndef group_end(key: [Int], ts: [Int], start: Int, who: Str) -> Int {\n    n = len(ts)\n    stop_at: Int = start + 1\n    while stop_at < n and key[stop_at] == key[start] {\n        if ts[stop_at] < ts[stop_at - 1] {\n            stop(f\"{who}: rows must be sorted by (key, ts); row {stop_at} goes back in time\")\n        }\n        stop_at += 1\n    }\n    if stop_at < n and key[stop_at] < key[start] {\n        stop(f\"{who}: rows must be sorted by (key, ts); the key falls at row {stop_at}\")\n    }\n    return stop_at\n}\n\n#| The end (exclusive) of the run of rows at row `i`'s instant, within a group\n#| ending at `stop_at`.\n#: i  the first row of the instant\n#: stop_at  the end of the key group\n#@ 9ee224e9\ndef instant_end(ts: [Int], i: Int, stop_at: Int) -> Int {\n    j: Int = i\n    while j < stop_at and ts[j] == ts[i] {\n        j += 1\n    }\n    return j\n}\n\ntest \"groups and instants\" {\n    key: [Int] = [1, 1, 1, 2]\n    ts: [Int] = [5, 5, 7, 0]\n    assert_true(group_end(key, ts, 0, \"t\") == 3 and group_end(key, ts, 3, \"t\") == 4)\n    assert_true(instant_end(ts, 0, 3) == 2 and instant_end(ts, 2, 3) == 3)\n}\n\n# SPDX-License-Identifier: MIT OR Apache-2.0\n# SPDX-FileCopyrightText: 2026 The Viv authors\n"}],"defs":[{"id":"streaks","module":0,"line":35,"end":72,"params":["user","ts"],"doc":"The current streak of active days and the longest streak inside the trailing\nwindow of days, for events sorted by (user, ts).\nThe user's distinct active days are kept in order with the length of the run\nthat ends on each; the window's longest run is a scan back over them.\nThe current streak has no lookback limit: serving it needs the user's whole\nrun of days, while the windowed one needs only the window.\nuser  the entity key, sorted ascending\nts  event time, int64 nanoseconds, ascending within a user\n@ 3b3c8dc8","intent":"The current streak of active days and the longest streak inside the trailing window of days, for events sorted by (user, ts).","dist":0,"from":null,"steps":[{"id":"extend","text":"the row's day joins the list of active days","line":46,"end":56},{"id":"window","text":"the longest run inside days d - 89 .. d","line":57,"end":65}],"loops":[{"line":40,"end":70,"depth":1,"head":"while g < n"},{"line":44,"end":68,"depth":2,"head":"for i from g to stop_at"},{"line":61,"end":64,"depth":3,"head":"while k >= 0 and days[k] >= lo"}],"calls":[["group_end",41,1,0],["day_of",45,2,0]],"indirect":[],"builtins":{"append":2,"int_zeros":2,"len":4,"max":1,"min":1}},{"id":"group_end","module":1,"line":10,"end":23,"params":["key","ts","start","who"],"doc":"The end (exclusive) of the key group that starts at row `start`, after\nchecking that the rows are sorted by (key, ts); `who` names the caller in\nthe error.\nkey  the entity key of each row\nts  each row's time, int64 nanoseconds\nstart  the first row of the group\n@ 2c0afca7","intent":"The end (exclusive) of the key group that starts at row `start`, after checking that the rows are sorted by (key, ts); `who` names the caller in the error.","dist":1,"from":"streaks","steps":[],"loops":[{"line":13,"end":18,"depth":1,"head":"while stop_at < n and key[stop_at] == key[start]"}],"calls":[],"indirect":[],"builtins":{"len":1,"stop":2}},{"id":"day_of","module":0,"line":78,"end":80,"params":["t"],"doc":"The UTC day number of a time in nanoseconds, rounded down (floor division,\nso times before the epoch fall on negative days).\nt  a time, int64 nanoseconds since the epoch\n@ 195681a7","intent":"The UTC day number of a time in nanoseconds, rounded down (floor division, so times before the epoch fall on negative days).","dist":1,"from":"streaks","steps":[],"loops":[],"calls":[],"indirect":[],"builtins":{}}],"contracts":[]}
