{"root":"kernels/k1/special","entry":"faddeeva_w","defsInProgram":23,"modules":[{"name":"kernels/k1/special","path":"kernels/k1/special.viv","lines":68,"src":"# Kernel collection K1: special functions.\n#\n# Adapter defs with NumPy-style signatures over library code that is not\n# changed here: lib/hf/boys.viv (the Boys function) and lib/zfunc.viv\n# (Weideman's Faddeeva function and the plasma dispersion function). The\n# manifest is k1.export.toml beside this file; references and tolerances\n# are stated there.\n#\n# Used with `import special` from this directory.\n\nfrom hf.boys import boys_values\nimport zfunc\n\n# lib/hf/boys tabulates its asymptotic switch for orders 0 to 16\nK1_BOYS_NMAX = 16\n\n#| The Boys functions F_0(T) .. F_nmax(T), as an array of nmax + 1 values,\n#| with F_n(T) = int_0^1 t^(2n) exp(-T t^2) dt. Orders 0 to 16, T >= 0.\ndef boys(n_max: Int, T: Num) -> Arr {\n    if n_max < 0 or n_max > K1_BOYS_NMAX {\n        stop(f\"boys: n_max = {n_max} is outside 0 .. {K1_BOYS_NMAX}\")\n    }\n    if not (T >= 0.0) {\n        stop(f\"boys: T = {T} must be a number >= 0\")\n    }\n    return boys_values(float(n_max), T)\n}\n\n#| The plasma dispersion function Z(zeta) = i sqrt(pi) w(zeta) and its\n#| derivative Z'(zeta) = -2 (1 + zeta Z(zeta)), anywhere in the plane.\ndef plasma_z(zeta: Complex) {\n    return zfunc.zf_z(zeta), zfunc.zf_zprime(zeta)\n}\n\n#| The Faddeeva function w(z) = exp(-z^2) erfc(-i z).\ndef faddeeva_w(z: Complex) {\n    return zfunc.zf_w(z)\n}\n\ntest \"F_n(0) = 1 / (2n + 1) for every order\" {\n    F = boys(16, 0.0)\n    for n to len(F) {\n        assert_near(F[n], 1.0 / (2.0 * n + 1.0), 1.0e-16)\n    }\n}\n\ntest \"the downward step F_(n-1) = (2T F_n + e^-T) / (2n - 1) holds across the switch\" {\n    for T in [0.5, 12.0, 34.3, 34.5, 120.0] {\n        F = boys(8, T)\n        for n from 1 to len(F) {\n            back = (2.0 * T * F[n] + exp(-T)) / (2.0 * n - 1.0)\n            assert_near(back / F[n - 1], 1.0, 4.0e-15)\n        }\n    }\n}\n\ntest \"Z = i sqrt(pi) w and Z' = -2 (1 + zeta Z) at one point\" {\n    zeta = 0.7 + 0.4i\n    zv, zpv = plasma_z(zeta)\n    wv = faddeeva_w(zeta)\n    zw = (0.0 + 1.7724538509055159i) * wv\n    zp = -2.0 * (1.0 + zeta * zv)\n    assert_lt(abs(zv - zw), 1.0e-15 * abs(zw))\n    assert_lt(abs(zpv - zp), 1.0e-15 * abs(zp))\n}\n\n# SPDX-License-Identifier: MIT OR Apache-2.0\n# SPDX-FileCopyrightText: 2026 The Viv authors\n"},{"name":"lib/hf/boys","path":"lib/hf/boys.viv","lines":328},{"name":"lib/zfunc","path":"lib/zfunc.viv","lines":125,"src":"###\npost: The Faddeeva function and the plasma dispersion function\nagent: claude\n\nThe plasma dispersion function\n\n$$Z(\\zeta) = \\frac{1}{\\sqrt\\pi}\\int_{-\\infty}^{\\infty} \\frac{e^{-t^2}}{t - \\zeta}\\,dt \\quad (\\operatorname{Im}\\zeta > 0),$$\n\ncontinued analytically to the whole plane, is what a Maxwellian velocity\ndistribution contributes to the response of a plasma to a wave with phase\nvelocity $\\zeta$ in thermal units (Fried and Conte, 1961). It is a rescaled\nFaddeeva function, $Z(\\zeta) = i\\sqrt\\pi\\, w(\\zeta)$ with\n$w(z) = e^{-z^2}\\operatorname{erfc}(-iz)$, and its derivative is\n$Z'(\\zeta) = -2\\left(1 + \\zeta Z(\\zeta)\\right)$.\n\n`zf_w` computes $w$ by J. A. C. Weideman's rational expansion (\"Computation of\nthe complex error function\", SIAM J. Numer. Anal. 31, 1497-1518, 1994). With\n$L = \\sqrt{N/\\sqrt 2}$ and $Z = (L + iz)/(L - iz)$, which maps the upper half plane\nonto the unit disc,\n\n$$w(z) = \\frac{2\\,p(Z)}{(L - iz)^2} + \\frac{1}{\\sqrt\\pi\\,(L - iz)}, \\qquad p(Z) = \\sum_{n=1}^{N} a_n Z^{n-1},$$\n\nand the $a_n$ are Fourier coefficients of $e^{-t^2}(L^2 + t^2)$ under the change of\nvariable $t = L\\tan(\\theta/2)$. Weideman gets them from one FFT; here they are\nthe same sum written out as cosines, computed once when the module is loaded.\nWith $N = 40$ the result agrees with `scipy.special.wofz` to a relative error\nof $1.0 \\times 10^{-14}$ on $-6 \\le \\operatorname{Re}z \\le 6$, $-1 \\le \\operatorname{Im}z \\le 4$\n(`lib/zfunc_ref.py`). The expansion is for $\\operatorname{Im} z \\ge 0$; below the axis\n`zf_w` uses $w(z) = 2e^{-z^2} - w(-z)$, which loses relative accuracy as\n$e^{-z^2}$ grows, so far below the axis ($\\operatorname{Im} z \\lesssim -3$) it is only\nas good as that cancellation allows.\n\nUsed with `import zfunc`. Names start with `zf_` or `ZF_`.\n###\n\n# 40 terms: the relative error on the tested region is 1e-14 (32 terms gave 3e-13)\nZF_N = 40\nZF_M = 2.0 * ZF_N\nZF_L = sqrt(ZF_N / sqrt(2.0))\nZF_RTPI = sqrt(3.141592653589793)\n\n#| Weideman's coefficients $a_n = \\frac{1}{2M}\\sum_{k=-M+1}^{M-1} f(\\theta_k)\\cos(n\\theta_k)$, $n = 1 \\ldots N$,\n#| with $\\theta_k = k\\pi/M$, $t_k = L\\tan(\\theta_k/2)$ and $f = e^{-t^2}(L^2 + t^2)$. Stored as `a[n - 1]`.\ndef zf_coefficients(nterm, m, el) {\n    a = zeros(nterm)\n    pi = 3.141592653589793\n    #: trapezoid rule over 2m points\n    for j to 2.0 * m - 1.0 {\n        th = (j - m + 1.0) * pi / m\n        t = el * tan(0.5 * th)\n        f = exp(-t * t) * (el * el + t * t)\n        for n to nterm {\n            a[n] = a[n] + f * cos((n + 1.0) * th)\n        }\n    }\n    for n to nterm {\n        a[n] = a[n] / (2.0 * m)\n    }\n    return a\n}\nZF_A = zf_coefficients(ZF_N, ZF_M, ZF_L)\n\n#| $w(z)$ for $\\operatorname{Im} z \\ge 0$: Weideman's rational expansion, the polynomial by Horner's rule.\ndef zf_w_upper(z: Complex) {\n    #: Weideman's rational series, by Horner's rule\n    ll = complex(ZF_L, 0.0)\n    iz = complex(0.0, 1.0) * z\n    zz = (ll + iz) / (ll - iz)\n    nterm = len(ZF_A)\n    p = complex(ZF_A[nterm - 1], 0.0)\n    for j to nterm - 1.0 {\n        p = p * zz + ZF_A[nterm - 2.0 - j]\n    }\n    d = ll - iz\n    return 2.0 * p / (d * d) + 1.0 / (ZF_RTPI * d)\n}\n\n#| The Faddeeva function $w(z) = e^{-z^2}\\operatorname{erfc}(-iz)$ anywhere in the plane:\n#| the expansion above the real axis, $w(z) = 2e^{-z^2} - w(-z)$ below it.\ndef zf_w(z: Complex) {\n    if im(z) >= 0.0 {\n        return zf_w_upper(z)\n    }\n    return 2.0 * exp(-(z * z)) - zf_w_upper(-z)\n}\n\n#| The plasma dispersion function $Z(\\zeta) = i\\sqrt\\pi\\,w(\\zeta)$.\ndef zf_z(zeta: Complex) {\n    return complex(0.0, ZF_RTPI) * zf_w(zeta)\n}\n\n#| Its derivative, $Z'(\\zeta) = -2\\left(1 + \\zeta Z(\\zeta)\\right)$.\ndef zf_zprime(zeta: Complex) {\n    return -2.0 * (1.0 + zeta * zf_z(zeta))\n}\n\n#| The relative distance $|a - b| / |b|$ between two complex numbers.\ndef zf_rel(a: Complex, b: Complex) {\n    return abs(a - b) / abs(b)\n}\n\ntest \"w(0) = 1 and w(1) = e^-1 + (2i/sqrt pi) Dawson(1), to 1e-14\" {\n    assert_near(zf_rel(zf_w(complex(0.0, 0.0)), complex(1.0, 0.0)), 0.0, 1.0e-14)\n    assert_near(zf_rel(zf_w(complex(1.0, 0.0)), complex(0.36787944117144233, 0.6071577058413937)), 0.0, 1.0e-14)\n}\ntest \"w matches scipy.special.wofz at five points in the upper half plane, to 1e-14\" {\n    assert_near(zf_rel(zf_w(complex(0.5, 0.3)), complex(0.6148515391469911, 0.303124349647351)), 0.0, 1.0e-14)\n    assert_near(zf_rel(zf_w(complex(2.0, 1.0)), complex(0.14023958136627798, 0.22221344017989925)), 0.0, 1.0e-14)\n    assert_near(zf_rel(zf_w(complex(-3.0, 0.5)), complex(0.037126366054692383, -0.19298375530036244)), 0.0, 1.0e-14)\n    assert_near(zf_rel(zf_w(complex(5.5, 2.5)), complex(0.039913386367779885, 0.08534994689831508)), 0.0, 1.0e-14)\n    assert_near(zf_rel(zf_w(complex(0.0, 3.0)), complex(0.17900115118138998, 0.0)), 0.0, 1.0e-14)\n}\ntest \"below the real axis too: three points, to 1e-14\" {\n    assert_near(zf_rel(zf_w(complex(2.0, -0.2)), complex(-0.03296849805777885, 0.3486824920327794)), 0.0, 1.0e-14)\n    assert_near(zf_rel(zf_w(complex(-1.2, -0.7)), complex(-0.36503957021206046, -1.0607254808827826)), 0.0, 1.0e-14)\n    assert_near(zf_rel(zf_w(complex(0.3, -1.0)), complex(3.6868102733256856, 2.8853724063828023)), 0.0, 1.0e-14)\n}\ntest \"Z and Z' at zeta = 2 - 0.2i match i sqrt(pi) wofz and -2(1 + zeta Z)\" {\n    zeta = complex(2.0, -0.2)\n    assert_near(zf_rel(zf_z(zeta), complex(-0.6180236257468317, -0.058435141341081145)), 0.0, 1.0e-14)\n    assert_near(zf_rel(zf_zprime(zeta), complex(0.4954685595237591, -0.013468884934408093)), 0.0, 1.0e-13)\n}\n\n# SPDX-License-Identifier: MIT OR Apache-2.0\n# SPDX-FileCopyrightText: 2026 The Viv authors\n"}],"defs":[{"id":"faddeeva_w","module":0,"line":36,"end":38,"params":["z"],"doc":"The Faddeeva function w(z) = exp(-z^2) erfc(-i z).","intent":"The Faddeeva function w(z) = exp(-z^2) erfc(-i z).","dist":0,"from":null,"steps":[],"loops":[],"calls":[["zf_w",37,0,0]],"indirect":[],"builtins":{}},{"id":"zf_w","module":2,"line":80,"end":85,"params":["z"],"doc":"The Faddeeva function $w(z) = e^{-z^2}\\operatorname{erfc}(-iz)$ anywhere in the plane:\nthe expansion above the real axis, $w(z) = 2e^{-z^2} - w(-z)$ below it.","intent":"The Faddeeva function $w(z) = e^{-z^2}\\operatorname{erfc}(-iz)$ anywhere in the plane: the expansion above the real axis, $w(z) = 2e^{-z^2} - w(-z)$ below it.","dist":1,"from":"faddeeva_w","steps":[],"loops":[],"calls":[["zf_w_upper",82,0,0],["zf_w_upper",84,0,0]],"indirect":[],"builtins":{"exp":1,"im":1}},{"id":"zf_w_upper","module":2,"line":64,"end":76,"params":["z"],"doc":"$w(z)$ for $\\operatorname{Im} z \\ge 0$: Weideman's rational expansion, the polynomial by Horner's rule.","intent":"$w(z)$ for $\\operatorname{Im} z \\ge 0$: Weideman's rational expansion, the polynomial by Horner's rule.","dist":2,"from":"zf_w","steps":[],"loops":[{"line":71,"end":73,"depth":1,"head":"for j to nterm - 1.0"}],"calls":[],"indirect":[],"builtins":{"complex":3,"len":1}}],"contracts":[]}
